number,title,authorids,authors,decision
33,Self-supervised Product Title Rewrite for Product Listing Ads,~Xue_Zhao1|~Dayiheng_Liu1|~Junwei_Ding1|~Liang_Yao3|~Mahone_Yan1|~Huibo_wang1|~Wenqing_Yao1,Xue Zhao|Dayiheng Liu|Junwei Ding|Liang Yao|Mahone Yan|Huibo wang|Wenqing Yao,Accept (Oral)
40,Local-to-global learning for iterative training of production SLU models on new features,~Yulia_Grishina1|~Daniil_Sorokin1,Yulia Grishina|Daniil Sorokin,Accept (Oral)
65,{M}edical Coding with Biomedical Transformer Ensembles and Zero/Few-shot Learning,~Angelo_Ziletti1|~Alan_Akbik2|christoph.berns1@bayer.com|thomas.herold@areto.de|marion.legler@bayer.com|martina.viell@bayer.com,Angelo Ziletti|Alan Akbik|Christoph Berns|Thomas Herold|Marion Legler|Martina Viell,Accept (Oral)
91,CTM - A Model for Large-Scale Multi-View Tweet Topic Classification,~Vivek_Kulkarni2|~Kenny_Leung1|~Aria_Haghighi1,Vivek Kulkarni|Kenny Leung|Aria Haghighi,Accept (Oral)
119,Self-Aware Feedback-Based Self-Learning in Large-Scale Conversational AI,~Pragaash_Ponnusamy1|~Clint_Solomon_Mathialagan2|~Gustavo_Aguilar1|~Chengyuan_Ma1|~Chenlei_Guo1,Pragaash Ponnusamy|Clint Solomon Mathialagan|Gustavo Aguilar|Chengyuan Ma|Chenlei Guo,Accept (Oral)